{
  "audits": {
    "artifacts": false,
    "boundedRetention": true,
    "cleanup": true,
    "firstAttemptsOnly": true,
    "networkIsolation": false,
    "offline": true,
    "privacy": true
  },
  "authorityCommitSha": "b66fafa743b84e8a995705ec3bbdf8fed6a9a04e",
  "cancellation": {
    "passedTrials": 0,
    "processesRemaining": 0,
    "requiredTrials": 8,
    "staleUnits": 0
  },
  "candidateId": "moss-tts-nano-100m-onnx-cpu-ava-v1",
  "candidateManifestSha256": "5245f6949cf035eee8de98fef21e8eea89d30b468d76039949e2100558401b0e",
  "corpusSha256": "cc140a35688dc0dff7e8c50a5355e920bd2847aa9deac2f7e6256160fb9afcfe",
  "counts": {
    "cancellationTrials": 0,
    "completedGenerations": 0,
    "failedGenerations": 0,
    "firstAttempts": 0
  },
  "dependencyLockSha256": "49d96b6b5121320290ba951be4a8a343f3380c2fc320182d6003b1dcf0d47bcb",
  "evaluationStage": "screen",
  "executionCommitSha": "c0b446132a88fb504b0d8bb5c5f931513952c145",
  "gates": {
    "cancellation": "not-admitted",
    "cleanup": "pass",
    "machine": "fail",
    "memory": "not-admitted",
    "overall": "fail",
    "performance": "not-admitted",
    "privacy": "pass",
    "quality": "not-admitted"
  },
  "languagesEvaluated": ["es", "en"],
  "limitations": [
    "model-load-failed",
    "exact-revision-artifact-size-mismatch",
    "frozen-artifact-name-missing",
    "runtime-substitution-forbidden"
  ],
  "memory": null,
  "performanceByLanguage": [],
  "profileSha256": "84448e70e8b8b2782f22c0e3d874b1b30531084732e0416ab9e83e1ad1e7525a",
  "qualityByLanguage": [
    {
      "language": "es",
      "status": "not-admitted"
    },
    {
      "language": "en",
      "status": "not-admitted"
    }
  ],
  "schemaVersion": "tts-bilingual-summary-v8",
  "status": "rejected"
}
